{
  "$schema": "https://json-schema.org/draft/2020-12/schema",
  "$id": "https://invalid.example/schemas/product-info-collection.schema.json",
  "title": "Collection-level product_info.json",
  "type": "object",
  "required": ["collection_type", "sku_prefix"],
  "properties": {
    "collection_type": {"type": "string", "minLength": 1},
    "title": {"type": "string"},
    "sku_prefix": {"type": "string", "minLength": 1},
    "price": {"$ref": "#/$defs/numberLike"},
    "sale_price": {"$ref": "#/$defs/numberLike"},
    "sale_start_date": {"type": "string", "format": "date"},
    "sale_end_date": {"type": "string", "format": "date"},
    "weight": {"$ref": "#/$defs/numberLike"},
    "country_of_origin": {"type": "string", "pattern": "^[A-Z]{2}$"},
    "requires_shipping": {"type": "boolean"},
    "customisation": {"type": "object"},
    "dimensions": {"$ref": "#/$defs/dimensions"},
    "categories": {"$ref": "#/$defs/stringArray"},
    "primary_category": {"anyOf":[{"type":"null"},{"type":"string","pattern":"^[a-z][a-z0-9_-]{0,95}$"}]},
    "manage_stock": {"type":"boolean"},
    "backorders": {"enum":["no","yes","notify"]},
    "storefront_collections": {"$ref": "#/$defs/stringArray"},
    "tags": {"$ref": "#/$defs/stringArray"},
    "live": {"type": "boolean"},
    "short_description": {"type": "string"},
    "description": {"type": "string"},
    "attributes": {"$ref": "#/$defs/attributes"},
    "variation_attributes": {"type": "array", "uniqueItems": true, "items": {"type": "string", "minLength": 1}},
    "image_attributes": {"$ref": "#/$defs/stringArray"},
    "variation_modifiers": {"$ref": "#/$defs/variationModifiers"},
    "shipping_class": {"type": "string"},
    "grouped_ids": {"$ref": "#/$defs/stringArray"},
    "grouped_products": {"$ref": "#/$defs/stringArray"},
    "upsell_ids": {"$ref": "#/$defs/stringArray"},
    "cross_sell_ids": {"$ref": "#/$defs/stringArray"},
    "upsells": {"$ref": "#/$defs/stringArray"},
    "crosssells": {"$ref": "#/$defs/stringArray"},
    "relationships": {"$ref": "#/$defs/relationships"},
    "meta_title": {"type": "string"},
    "meta_description": {"type": "string"}
  },
  "additionalProperties": true,
  "$defs": {
    "numberLike": {
      "oneOf": [
        {"type": "number"},
        {"type": "string", "pattern": "^-?[0-9]+(?:\\.[0-9]+)?$"}
      ]
    },
    "stringArray": {
      "type": "array",
      "items": {"type": "string"}
    },
    "relationshipArray": {
      "type": "array",
      "items": {"type": "string", "minLength": 1, "maxLength": 64},
      "uniqueItems": true
    },
    "relationships": {
      "type": "object",
      "properties": {
        "cross_sells": {"$ref": "#/$defs/relationshipArray"},
        "upsells": {"$ref": "#/$defs/relationshipArray"}
      },
      "additionalProperties": false
    },
    "dimensions": {
      "type": "object",
      "properties": {
        "length": {"$ref": "#/$defs/numberLike"},
        "width": {"$ref": "#/$defs/numberLike"},
        "height": {"$ref": "#/$defs/numberLike"}
      },
      "additionalProperties": false
    },
    "attributeValues": {
      "type": "array",
      "minItems": 0,
      "items": {"type": ["string", "number", "boolean"]}
    },
    "attributes": {
      "type": "object",
      "additionalProperties": {"$ref": "#/$defs/attributeValues"}
    },
    "variationModifier": {
      "type": "object",
      "properties": {
        "price": {"$ref": "#/$defs/numberLike"},
        "sale_price": {"$ref": "#/$defs/numberLike"},
        "weight": {"$ref": "#/$defs/numberLike"},
        "dimensions": {"$ref": "#/$defs/dimensions"}
      },
      "additionalProperties": false
    },
    "variationModifiers": {
      "type": "object",
      "additionalProperties": {"$ref": "#/$defs/variationModifier"}
    }
  }
}
