{
    "sku_prefix": "NBNOC-",
    "collection_type": "Simple",
    "title": "Naughty but Nice set | Christmas Tree",
    "short_description": "[cg_accordion title='Core Features']<ul><li><strong>Material:</strong> Crafted from two layers of poplar plywood, ensuring durability and a natural aesthetic.</li><li><strong>Dimensions:</strong> Each ornament measures 100mm x 100mm with an added 10mm ring for hanging. The layers are 2 layers of 3mm poplar plywood.</li><li><strong>Customization Options:</strong> Choose from our collection of 24 witty and naughty 'Naughty but Nice' puns to personalize the top layer of your ornament. The backing can be customized with various stain colors.</li><li><strong>Production Time:</strong> Please allow 5-10 days for production, as each ornament is custom-made.</li></ul>[/cg_accordion][cg_accordion title='Details']Our handcrafted 'Naughty but Nice' Christmas tree ornaments offer a playful and irreverent twist on traditional holiday decor. The double-layered poplar wood base can be stained in various colors, while the top layer features one of our 24 witty puns, adding a touch of humor to your Christmas tree. Each ornament is meticulously crafted with precision and attention to detail, ensuring a high-quality and durable product.[/cg_accordion][cg_accordion title='Delivery & Returns']<ul><li><strong>Shipping:</strong> Please allow 5-10 days for production. Once completed, your ornament will be shipped via Royal Mail 48h tracked service.</li><li><strong>Returns:</strong> Returns are accepted within 14 days of purchase at the customer's expense. The returned item must be registered post to ensure safe delivery.</li></ul>[/cg_accordion]",
    "live": false,
    "meta_title": "Naughty But Nice Ornament",
    "meta_description": "Cheeky double-layer wooden ornament with funny puns and custom backing. A playful gift for Christmas.",
    "price": "6.50",
    "weight": "50",
    "categories": [
        "Ornaments"
    ],
    "tags": [
        "Naughty But Nice",
        "Christmas",
        "Funny",
        "For Him",
        "For Her",
        "For Couples",
        "Wooden"
    ],
    "dimensions": {
        "length": "110",
        "width": "100",
        "height": "6"
    }
}