{
  "collection_type": "Simple",
  "sku_prefix": "FIC-S-",
  "title": "Fictional Desk Token",
  "price": "8.50",
  "categories": ["Fictional Goods"],
  "tags": ["baseline", "shared"],
  "weight": 25,
  "dimensions": {"length": 40, "width": 40, "height": 3},
  "short_description": "A fabricated test product.",
  "description": "Synthetic metadata used only by isolated tests."
}
