{
  "collection_type": "Variable Collection",
  "sku_prefix": "FIC-V-",
  "title": "Fictional Badge",
  "price": "10.00",
  "weight": 30,
  "dimensions": {"length": 50, "width": 50, "height": 4},
  "categories": ["Fictional Goods"],
  "tags": ["variable"],
  "attributes": {"Colour": ["Amber", "Teal"], "Size": ["Small", "Large"]},
  "variation_modifiers": {
    "Size=Large": {"price": "12.00", "weight": 45, "dimensions": {"length": 70, "width": 70, "height": 5}}
  }
}
